{
  "timestamp": "2026-10-22T18:26:05.191046+00:00",
  "runId": "5c07841c",
  "validationPassed": true,
  "changes": [
    {
      "board": "crb",
      "meetings": 27,
      "upcoming": 1
    },
    {
      "board": "bra",
      "meetings": 49,
      "upcoming": 2
    },
    {
      "board": "cpsrab",
      "meetings": 51,
      "upcoming": 6
    },
    {
      "board": "dda",
      "meetings": 43,
      "upcoming": 2
    },
    {
      "board": "dega",
      "meetings": 46,
      "upcoming": 2
    },
    {
      "board": "edc",
      "meetings": 46,
      "upcoming": 2
    },
    {
      "board": "ec",
      "meetings": 16,
      "upcoming": 0
    },
    {
      "board": "ecc",
      "meetings": 27,
      "upcoming": 2
    },
    {
      "board": "hdc",
      "meetings": 44,
      "upcoming": 2
    },
    {
      "board": "hpc",
      "meetings": 40,
      "upcoming": 2
    },
    {
      "board": "locc",
      "meetings": 3,
      "upcoming": 0
    },
    {
      "board": "nfp",
      "meetings": 29,
      "upcoming": 3
    },
    {
      "board": "pc",
      "meetings": 58,
      "upcoming": 3
    },
    {
      "board": "zba",
      "meetings": 60,
      "upcoming": 3
    },
    {
      "board": "ersb",
      "meetings": 12,
      "upcoming": 1
    },
    {
      "board": "prab",
      "meetings": 6,
      "upcoming": 2
    },
    {
      "board": "trb",
      "meetings": 2,
      "upcoming": 0
    },
    {
      "board": "bor",
      "meetings": 1,
      "upcoming": 0
    },
    {
      "board": "ric",
      "meetings": 2,
      "upcoming": 1
    },
    {
      "board": "kmga",
      "meetings": 7,
      "upcoming": 2
    },
    {
      "board": "tre",
      "meetings": 6,
      "upcoming": 2
    },
    {
      "board": "bba",
      "meetings": 7,
      "upcoming": 2
    },
    {
      "board": "cdaac",
      "meetings": 2,
      "upcoming": 2
    },
    {
      "board": "ncbda",
      "meetings": 29,
      "upcoming": 1
    },
    {
      "board": "spk",
      "meetings": 12,
      "upcoming": 0
    }
  ]
}
